{
  "schemaVersion": 1,
  "id": "overhand",
  "coordinateSystem": "right-handed-y-up",
  "units": "relative",
  "curves": [
    {
      "id": "open",
      "closed": false,
      "interpolation": { "type": "catmullrom", "tension": 0.5 },
      "radius": 0.46,
      "points": [
        [-10, 0, 0],
        [-8, 0, 0.6],
        [-6, 0.1, 1.0],
        [-4, 0.35, 0.7],
        [0.5, 1.4, -0.8],
        [3.7, 2.0, 0.3],
        [5.8, 0.7, 0.25],
        [5.8, -2, 0.1],
        [3.8, -4.4, 0],
        [0, -5.4, 0],
        [-3.8, -4.4, 0],
        [-5.8, -2, -0.1],
        [-5.8, 0.7, -0.25],
        [-3.7, 2.0, -0.3],
        [-0.5, 1.4, 0.8],
        [4, 0.35, -0.7],
        [6, 0.1, -1.0],
        [8, 0, -0.6],
        [10, 0, 0]
      ]
    }
  ]
}
