{
  "schemaVersion": 1,
  "id": "prototype-loop",
  "coordinateSystem": "right-handed-y-up",
  "units": "relative",
  "curves": [
    {
      "id": "rope-1",
      "closed": true,
      "interpolation": {
        "type": "catmullrom",
        "tension": 0.7
      },
      "radius": 0.5,
      "points": [
        [
          3,
          -6,
          -1
        ],
        [
          0,
          -10.5,
          0
        ],
        [
          -3,
          -6,
          1
        ],
        [
          5,
          5,
          -0.2
        ],
        [
          0,
          10,
          0
        ],
        [
          -5,
          5,
          0.2
        ]
      ]
    }
  ],
  "preview": {
    "cameraPosition": [
      0,
      10,
      26
    ],
    "target": [
      0,
      0,
      0
    ],
    "fov": 55,
    "preset": "light-outline-v1"
  }
}
